{
  "artifact_types": [
    "SKILL.md",
    "contract.json",
    "provenance.json"
  ],
  "boundaries": {
    "input": "Product facts, a brief, design assets, tokens, components, surface context, and references.",
    "output": "A design read, selected direction, constraints, spatial thesis, and auditable direction contract."
  },
  "dependencies": [
    "cluster:existing-interface-redesign-and-preservation",
    "cluster:ui-task-routing-and-governance"
  ],
  "forbidden_actions": [
    "claim purification or release",
    "execute without required permissions and evidence",
    "fabricate or infer missing evidence"
  ],
  "gates": [
    "source-review",
    "semantic-evaluation",
    "dependency-validation",
    "release-evidence"
  ],
  "hard_failures": [
    "missing-source-evidence",
    "missing-required-permission",
    "unresolved-dependency",
    "fabricated-evidence",
    "incorrect-gate-pass"
  ],
  "id": "design-context-and-direction-contract",
  "inputs": [
    "Product facts, a brief, design assets, tokens, components, surface context, and references."
  ],
  "outputs": [
    "A design read, selected direction, constraints, spatial thesis, and auditable direction contract."
  ],
  "permissions": {
    "default": "none",
    "requires_explicit_authorization": true
  },
  "responsibility": "Read product and visual authority and define the audience, surface mode, direction, and design contract.",
  "schema_version": "1.0",
  "status": "draft",
  "statuses": [
    "draft"
  ],
  "version": "0.0.0-draft"
}
