{
  "artifact_types": [
    "SKILL.md",
    "contract.json",
    "provenance.json"
  ],
  "boundaries": {
    "input": "A research objective, participant context, consent boundary, and interview script.",
    "output": "Interview evidence, direct observations, notes, and explicit follow-up gaps."
  },
  "dependencies": [
    "cluster:research-planning-and-governance"
  ],
  "forbidden_actions": [
    "claim purification or release",
    "execute without required permissions and evidence",
    "fabricate or infer missing evidence"
  ],
  "gates": [
    "source-review",
    "semantic-evaluation",
    "dependency-validation",
    "release-evidence"
  ],
  "hard_failures": [
    "missing-source-evidence",
    "missing-required-permission",
    "unresolved-dependency",
    "fabricated-evidence",
    "incorrect-gate-pass"
  ],
  "id": "customer-interview-execution",
  "inputs": [
    "A research objective, participant context, consent boundary, and interview script."
  ],
  "outputs": [
    "Interview evidence, direct observations, notes, and explicit follow-up gaps."
  ],
  "permissions": {
    "default": "none",
    "requires_explicit_authorization": true
  },
  "responsibility": "Prepare and conduct non-leading customer interviews with context, probes, notes, and evidence-preserving closure.",
  "schema_version": "1.0",
  "status": "draft",
  "statuses": [
    "draft"
  ],
  "version": "0.0.0-draft"
}
