{
  "artifact_types": [
    "SKILL.md",
    "contract.json",
    "provenance.json"
  ],
  "boundaries": {
    "input": "A UI brief, stack, design references, existing tokens, and project conventions.",
    "output": "A selected or generated system foundation, component rules, theme decisions, and persistence contract."
  },
  "dependencies": [
    "cluster:design-context-and-direction-contract"
  ],
  "forbidden_actions": [
    "claim purification or release",
    "execute without required permissions and evidence",
    "fabricate or infer missing evidence"
  ],
  "gates": [
    "source-review",
    "semantic-evaluation",
    "dependency-validation",
    "release-evidence"
  ],
  "hard_failures": [
    "missing-source-evidence",
    "missing-required-permission",
    "unresolved-dependency",
    "fabricated-evidence",
    "incorrect-gate-pass"
  ],
  "id": "design-system-foundation-and-token-extraction",
  "inputs": [
    "A UI brief, stack, design references, existing tokens, and project conventions."
  ],
  "outputs": [
    "A selected or generated system foundation, component rules, theme decisions, and persistence contract."
  ],
  "permissions": {
    "default": "none",
    "requires_explicit_authorization": true
  },
  "responsibility": "Choose or generate an in-project design-system foundation, including component rules, theme decisions, and persistence policy.",
  "schema_version": "1.0",
  "status": "draft",
  "statuses": [
    "draft"
  ],
  "version": "0.0.0-draft"
}
