{
  "artifact_types": [
    "SKILL.md",
    "contract.json",
    "provenance.json"
  ],
  "boundaries": {
    "input": "A proposed advantage, customer evidence, cost structure, workflow, and imitation scenario.",
    "output": "A mechanism-backed moat hypothesis, imitation limits, and residual vulnerability."
  },
  "dependencies": [
    "cluster:market-segmentation-and-demand-intelligence"
  ],
  "forbidden_actions": [
    "claim purification or release",
    "execute without required permissions and evidence",
    "fabricate or infer missing evidence"
  ],
  "gates": [
    "source-review",
    "semantic-evaluation",
    "dependency-validation",
    "release-evidence"
  ],
  "hard_failures": [
    "missing-source-evidence",
    "missing-required-permission",
    "unresolved-dependency",
    "fabricated-evidence",
    "incorrect-gate-pass"
  ],
  "id": "structural-power-and-moats",
  "inputs": [
    "A proposed advantage, customer evidence, cost structure, workflow, and imitation scenario."
  ],
  "outputs": [
    "A mechanism-backed moat hypothesis, imitation limits, and residual vulnerability."
  ],
  "permissions": {
    "default": "none",
    "requires_explicit_authorization": true
  },
  "responsibility": "Test whether advantage comes from durable structural mechanisms, switching costs, operational asymmetry, or business rules rather than surface features.",
  "schema_version": "1.0",
  "status": "draft",
  "statuses": [
    "draft"
  ],
  "version": "0.0.0-draft"
}
