{
  "artifact_types": [
    "SKILL.md",
    "contract.json",
    "provenance.json"
  ],
  "boundaries": {
    "input": "An AI task, data sources, latency and cost constraints, model options, and quality targets.",
    "output": "A model/data architecture, routing rationale, data contract, prompt strategy, and evaluation plan."
  },
  "dependencies": [
    "cluster:ai-capability-architecture-and-autonomy"
  ],
  "forbidden_actions": [
    "claim purification or release",
    "execute without required permissions and evidence",
    "fabricate or infer missing evidence"
  ],
  "gates": [
    "source-review",
    "semantic-evaluation",
    "dependency-validation",
    "release-evidence"
  ],
  "hard_failures": [
    "missing-source-evidence",
    "missing-required-permission",
    "unresolved-dependency",
    "fabricated-evidence",
    "incorrect-gate-pass"
  ],
  "id": "ai-model-and-data-architecture",
  "inputs": [
    "An AI task, data sources, latency and cost constraints, model options, and quality targets."
  ],
  "outputs": [
    "A model/data architecture, routing rationale, data contract, prompt strategy, and evaluation plan."
  ],
  "permissions": {
    "default": "none",
    "requires_explicit_authorization": true
  },
  "responsibility": "Choose model routing, data sizing and freshness, retrieval preparation, prompt implementation, and evaluation boundaries.",
  "schema_version": "1.0",
  "status": "draft",
  "statuses": [
    "draft"
  ],
  "version": "0.0.0-draft"
}
