{
  "artifact_types": [
    "SKILL.md",
    "contract.json",
    "provenance.json"
  ],
  "boundaries": {
    "input": "A direction contract, brand, tokens, audience, surface mode, and content.",
    "output": "Typography, color, material, composition, style decisions, and anti-template constraints."
  },
  "dependencies": [
    "cluster:design-context-and-direction-contract",
    "cluster:design-system-foundation-and-token-extraction"
  ],
  "forbidden_actions": [
    "claim purification or release",
    "execute without required permissions and evidence",
    "fabricate or infer missing evidence"
  ],
  "gates": [
    "source-review",
    "semantic-evaluation",
    "dependency-validation",
    "release-evidence"
  ],
  "hard_failures": [
    "missing-source-evidence",
    "missing-required-permission",
    "unresolved-dependency",
    "fabricated-evidence",
    "incorrect-gate-pass"
  ],
  "id": "visual-language-and-anti-template-controls",
  "inputs": [
    "A direction contract, brand, tokens, audience, surface mode, and content."
  ],
  "outputs": [
    "Typography, color, material, composition, style decisions, and anti-template constraints."
  ],
  "permissions": {
    "default": "none",
    "requires_explicit_authorization": true
  },
  "responsibility": "Establish a distinctive visual language and suppress generic template patterns and unsupported decoration.",
  "schema_version": "1.0",
  "status": "draft",
  "statuses": [
    "draft"
  ],
  "version": "0.0.0-draft"
}
